{
  "type": "object",
  "properties": {
    "userId": {
      "type": "string",
      "$schema": "https://json-schema.org/draft/2020-12/schema",
      "title": "id"
    },
    "countryId": {
      "type": "string",
      "$schema": "https://json-schema.org/draft/2020-12/schema",
      "title": "id"
    },
    "regionId": {
      "type": "string",
      "$schema": "https://json-schema.org/draft/2020-12/schema",
      "title": "id"
    },
    "cityId": {
      "type": "string",
      "$schema": "https://json-schema.org/draft/2020-12/schema",
      "title": "id"
    },
    "neighborhoodId": {
      "type": "string",
      "$schema": "https://json-schema.org/draft/2020-12/schema",
      "title": "id"
    },
    "address": {
      "type": "string",
      "$schema": "https://json-schema.org/draft/2020-12/schema",
      "title": "address"
    },
    "postalCode": {
      "type": "string",
      "$schema": "https://json-schema.org/draft/2020-12/schema",
      "title": "postalCode"
    },
    "latitude": {
      "type": "number",
      "format": "double",
      "$schema": "https://json-schema.org/draft/2020-12/schema",
      "title": "latitude"
    },
    "longitude": {
      "type": "number",
      "format": "double",
      "$schema": "https://json-schema.org/draft/2020-12/schema",
      "title": "longitude"
    },
    "locationType": {
      "$ref": "#/components/schemas/LocationType",
      "$schema": "https://json-schema.org/draft/2020-12/schema",
      "title": "locationType"
    }
  },
  "required": [
    "address",
    "cityId",
    "countryId",
    "locationType",
    "regionId",
    "userId"
  ],
  "$schema": "https://json-schema.org/draft/2020-12/schema",
  "title": "CreateLocationRequest"
}